{
  "version": "0.4.0-alpha",
  "containerId": "CLI-LXC-Hello-World",
  "containment": "lxc",
  "platform": "linux",
  "process": {
    "commandLine": "echo 'Hello from LXC' && uname -a"
  },
  "lifecycle": {
    "destroyOnExit": true
  },
  "lxc": {
    "distribution": "alpine",
    "release": "3.23"
  }
}