{
  "version": "0.4.0-alpha",
  "containerId": "CLI-LXC-Timeout-Test",
  "containment": "lxc",
  "platform": "linux",
  "process": {
    "commandLine": "echo 'Starting long task'; sleep 120; echo 'Should not reach here'",
    "timeout": 5000
  },
  "lifecycle": {
    "destroyOnExit": true
  },
  "lxc": {
    "distribution": "alpine",
    "release": "3.23"
  }
}
